{
  "image": "dummy/16-9-s.png",
  "topic": "Lorem Ipsum",
  "text": "Lorem ipsum dolor sit amet, consectetur adipisicing elit. Lorem ispum dolor distinctio minima unde voluptatum aut. Lorem ipsum dolor sit amet.",
  "link": {
    "label": "ruhmesmeile",
    "style": "solid",
    "open-in-tab": true
  }
}
